{
  "$schema": "https://raw.githubusercontent.com/sevten/pi-data-masking/main/src/config/masking.config.schema.json",
  "version": 1,
  "enabled": true,
  "rules": [
    {
      "id": "internal-database-host",
      "name": "Internal database host",
      "enabled": false,
      "description": "Exact literal with a stable, realistic-looking replacement",
      "real": "db.prod.internal.example",
      "placeholder": "db-primary.prod.corpnet.internal"
    },
    {
      "id": "production-api-key",
      "name": "Production API key",
      "enabled": true,
      "description": "Production API key read without storing its value in this file",
      "realFromEnv": "PROD_API_KEY",
      "preserveStructure": {
        "keepPrefix": true
      }
    },
    {
      "id": "application-token",
      "name": "Application token",
      "enabled": false,
      "description": "Custom regex matching secret_ followed by 24 ASCII letters or digits",
      "type": "regex",
      "pattern": "\\bsecret_[A-Za-z0-9]{24}\\b"
    },
    {
      "id": "github-personal-access-token",
      "name": "GitHub personal access token",
      "enabled": true,
      "description": "Materialized from the github-pat template (Rule Builder: Built-in preset template)",
      "type": "regex",
      "pattern": "\\bghp_[A-Za-z0-9]{36}\\b|\\bgithub_pat_[A-Za-z0-9_]{22,}\\b",
      "restoreScope": {
        "destinations": [
          "github.com",
          "api.github.com"
        ],
        "mode": "strict",
        "onRefuse": "block"
      }
    },
    {
      "id": "scoped-deploy-token",
      "name": "Scoped deploy token",
      "enabled": false,
      "description": "restoreScope: the value is restored only for local config writes and only strict-verified stripe.com destinations",
      "realFromEnv": "DEPLOY_TOKEN",
      "restoreScope": {
        "destinations": [
          "stripe.com"
        ],
        "tools": [
          "write",
          "edit"
        ],
        "mode": "strict",
        "onRefuse": "block"
      }
    }
  ],
  "options": {
    "showStatusBar": true,
    "systemPromptGuidance": false,
    "disclosePlaceholders": false,
    "persistHistory": true,
    "trustedDestinations": [
      "artifactory.corp.internal",
      "10.0.*"
    ],
    "allowlist": [
      "10.0.0.5",
      {
        "text": "authorization: bearer example",
        "caseSensitive": false
      }
    ]
  }
}
